{
  "status": "done",
  "summary": "Read as: work request at defined-feature altitude. Shaped request: add a user-facing dark mode toggle to the Missions desktop app settings page so users working at night are not blinded by the light theme. Why: the outcome and user are clear, but no Missions desktop app or settings page exists in this repo (it is the agentic-workflow plugin), so confirm the target repo first.",
  "changed_paths": [],
  "gates": [],
  "deviations": [
    "peak context ≈ 11376 tokens (first request 6729); window 100000"
  ],
  "next": [
    "Recommended route, not executed by Intake: /agentic-workflow:plan to decompose the toggle, then /agentic-workflow:mission for the decided slice. The orchestrator runs it.",
    "Human to confirm first: which repository holds the Missions desktop app and settings page; run the route there if it is not this repo.",
    "Human to confirm: whether the theme follows the OS setting or is a manual toggle only.",
    "parent CLAUDE_CODE_AUTO_COMPACT_WINDOW=unset"
  ],
  "blocked_reason": null,
  "runtime": {
    "name": "claude-p",
    "model": "claude-haiku-5-5",
    "effort": "low",
    "thread_id": "bdba1d27-2b3a-485c-baaf-c8c2f62e7342"
  },
  "usage": {
    "input_tokens": 37203,
    "output_tokens": 2366
  },
  "high_impact_touched": []
}
