{
  "status": "done",
  "summary": "Appended the AC-9 run bullet under the first `## [Unreleased]` in CHANGELOG.md, replacing its `_(empty)_` placeholder. Nothing else touched; no commit made.",
  "changed_paths": [
    "CHANGELOG.md"
  ],
  "gates": [],
  "deviations": [
    "Replaced the `_(empty)_` placeholder under [Unreleased] rather than leaving it beside the bullet. CHANGELOG.md also has a second `## [Unreleased]` heading at around line 379; I left it alone and did not check it.",
    "peak context ≈ 12424 tokens (first request 10694); window 100000"
  ],
  "next": [
    "Owner or orchestrator to review the second `## [Unreleased]` heading (~line 379) for a possible duplicate.",
    "parent CLAUDE_CODE_AUTO_COMPACT_WINDOW=unset"
  ],
  "blocked_reason": null,
  "runtime": {
    "name": "claude-p",
    "model": "claude-haiku-5-5",
    "effort": "low",
    "thread_id": "3495e699-ad99-43aa-86d2-264933c555e9"
  },
  "usage": {
    "input_tokens": 57691,
    "output_tokens": 1462
  },
  "high_impact_touched": []
}
